{
  "schema_version": "1.0.0",
  "correction_id": "correction_001",
  "marker_id": "marker_002",
  "subject_id": "subj_001",
  "gumi_instance_id": "gumi_001",
  "hermes_profile_id": "hermes_gumi_subj_001",

  "authoritative": true,

  "subject_words": ["not too fast, just right actually"],
  "gumi_agreed_words": [],
  "correction_note": "Subject corrected the wording.",

  "status": "active",
  "created_at": "2026-05-08T12:00:00Z",
  "created_by": "subject",

  "original_marker_id": "marker_001",
  "is_replacement": true
}